{
  "schema_version": "lnv.collector.dataset.v1",
  "collector": {
    "tech_id": "Lenovo.DE",
    "module": "LNV.AsBuiltDoc.Lenovo.DE",
    "entry_point": "Invoke-LnvAsBuiltDoc.Lenovo.DE"
  },
  "source": {
    "bundle_id": "target_de-prod-01",
    "bundle_root": "C:\\Github\\LNV.AsBuiltDoc.Core\\out\\e32facfb-29e5-4e8f-ad71-a695aa391920\\datasets\\Lenovo.DE\\collector-out\\de-prod-01\\target_de-prod-01",
    "file": "system_1_DE4200_Rack4/identity-sources.json"
  },
  "dataset": {
    "key": "identity-sources",
    "schema_path": "tech/Lenovo.DE/dataset/identity-sources.schema.json"
  },
  "item_count": 0,
  "items": []
}
