{
  "schema_version": "lnv.collector.dataset.v1",
  "collector": {
    "tech_id": "Lenovo.DE",
    "module": "LNV.AsBuiltDoc.Lenovo.DE",
    "entry_point": "Invoke-LnvAsBuiltDoc.Lenovo.DE"
  },
  "source": {
    "bundle_id": "canonical-de-gui",
    "file": "datasets/Lenovo.DE/core/de-prod-01/identity-sources.json",
    "domain": "core",
    "target_key": "de-prod-01"
  },
  "dataset": {
    "key": "identity-sources",
    "schema_path": "tech/Lenovo.DE/dataset/identity-sources.schema.json"
  },
  "item_count": 0,
  "items": []
}
